"city_name","rest_name","screenname","member_id","review_language","user_loc","rating","review_date","review_quote","review_text"
"chicago","Acadia","Taylor B","0E2E275F65CA1957688A5DB1792ECF7F","en","Chicago, Illinois","5","January 6, 2017","It's worth two Michelin stars","I had never heard of Acadia until I read a restaurant survey that rated Acadia's hamburger as one of the best in the Chicago area. But I thought Acadia was an upscale, high-brow restaurant that emphasized Chinese duck, pig heart tartare, Hudson Valley foie gras and Tasmanian ocean trout, not hamburgers. But a visit to Acadia, which is located at 1639 South Wabash on Chicago's South Side, reveals that it is much more than that. Hamburger joints don't rate two stars by Michelin. As such, Acadia is one of the top five restaurants in the Chicago area. It also offers a tasting menu, a sampling of a lot of tasty items that is becoming very popular at quality restaurants across the country. Another exceptional feature of chef/owner Ryan McCaskey's restaurant is the impeccable service and the presentation of each course. Do you want to know the story behind Golden Thai snapper or Indiana duck or Maine seafood Tom Kha? They'll tell you. This isn't a place for traditional food. No shrimp cocktail or Caesar salad. It's an enjoyable dining experience for discriminating diners who want to sample different a host of fresh and innovative and delicious culinary creations that you won't find anywhere else. I was especially impressed with the Tiger shrimp and Tasmanian ocean trout. I was reluctant to order lobster because it is too rich for my blood, like crab cakes, but my wife was persuaded to give it a try. She wasn't disappointed. There isn't anything more fresh than Maine lobster. Acadia knows how to prepare it as if the restaurant was located in Gloucester. But I'll stick with shrimp and trout and a chocolate/lemon dessert. And the hamburger. With two Michelin stars on the front door, they must be doing something right."
"chicago","Acadia","dramady","1DD7C1EAD4866F3998BCF7532032028C","en","Houston, Texas","5","December 25, 2016","A great experience","This is our first experience with a Michelin star restaurant and it was well worth it: from watching the bartender make our drinks, to the coordinated delivery and removal of our plates, this felt like an event.We had the 5-course tasting menu and are glad we didn't have more: the 5 was more like 8-9 and more than enough to leave us feeling comfortable. The presentation and ""story"" of each course was wonderful and we even had the pleasure to witness a man proposing to his girlfriend! (she accepted :) ). We were given a personalized menu, commemorating our visit and a small bag of their granola to take with us. A lovely time - we recommend Acadia!"
"chicago","Acadia","coleeno814","7443D023556128BAEB9D362C21032751","en","(null)","5","November 25, 2016","Top grades for this place","One of the best dining experiences ever. We had the five course tasting and was definitely satisfied when we left. Excellent wine list and definitely get the coffee with dessert and try all the different and delicious sweeteners the bring. My next trip will be for the ten course tasting, and hopefully I can eat that much "
"chicago","Acadia","tisidor","28C9D208042D2A9A1C0FA0F128FD916B","en","Paris, France","2","November 15, 2016","Portions too small, some were very tasty but left hungry and didn't care for the experience.","The restaurant is in an area that I drive past frequently and I had never noticed the understated elegance of Acadia and the valet parking sign. You enter into a sophisticated small bar area with all the latest Japanese liquors and few of the typical name brands. I thought ""uh-oh"" this place might be too foo-foo for me, and I was right. The bartender was less than friendly and we opted not to order drinks. Our wait wasn't long and we were led into a nice size dining room where simplicity reigns with no table cloths and little on the tables. Clearly the restaurant has an Asian theme and there were many servers in attendance, but the wait to get some food was way too long. Water came quickly and nothing else for 10-15 minutes. No bread, no nothing.And then we began our 5 course tasting menu. I've found that tasting sometimes means you'll leave the restaurant hungry and that sure was the case.The truffle cookie was good, as were 2 of the 3 others in a box. The lobster roll was tasty but truly bite size, the cured tuna was bursting with flavor and my taste buds were loving it; but the olive bon bon was absolutely terrible and spoiled everything. Yuck! Don't know who thought that was a good idea. The cavier, potato soup was in the smallest thumbnail bowl possible but delectable. I was getting worried because the portions were so small. The Thai peanut soup was ok but the lobster was underwhelming and the pheasant ravioli was terrible. I purchased the Miyazaki beef for an additional $75 and it was good, but for $75 it was terribly overpriced. The little stories the servers told you about the chef inspired dishes was interesting, but without more food was an exercise in futility. The chocolate and deserts were adequate, but for a restaurant that clearly is catering to an upscale crowd, it was a big miss for me. Much too long a dining experience and overly expensive considering we left hungry."
"chicago","Acadia","24601Panda","264D777AA2E505227BA7C96B2DA9929B","en","Charleston, South Carolina","5","November 14, 2016","Worth a trip","Approachable high end dining, with value. A bit out of the way, but well worth it. Great bar area too. 5 course menu under 2 hours. 10 course around 3. Will def be back!"
"chicago","Acadia","taiya2015","75693094272CA2B4B53025DF9902D3F5","en","Chicago, Illinois","5","November 14, 2016","5 star dining at 2 michelin stars restaurant","great place to enjoy fine dining to celebrate a special occasion... do go for the ten coarse with wine pairing... but for a less formal occasion opt for 5 course with a glass of your favorite wine or even at the bar which is first come first serve"
"chicago","Acadia","Ed T","19A97367D51CDFA054EA453718711E7E","en","Toronto","5","November 11, 2016","Wagyu beef heaven","Happy wife, happy life. Wife, extremely happy after our visit to Acadia. We enjoyed an outstanding tasting menu. A great taxi ride back to our hotel. We had a fun night.The food is superb, complimented by great service.Enjoy."
"chicago","Acadia","Zimco01","58D80DAEA06C68420CB5A888FCDF800D","en","Warren, Michigan","5","October 28, 2016","5 star dining and service","had the wine and food tasting menu 5 courses service is above average and the food was to die for if you are looking for an above average dining experience the 2 Michelin star's her do not disappoint"
"chicago","Acadia","stephen s","AD4E4EC5F45CC66B469359D81534D5CC","en","Oakland, California","5","September 29, 2016","worth the star","First congrats on their 2nd Michelin star.Had the 10-course tasting menu. Service is top notch, staffs were super friendly and professional. live up to 2 stars in service. Food I would give a 9 out of 10. Almost all the dishes were really good, and I would say 3 of them were amazing (Michelin standard) Michelin food all looks good, but they need to taste better than their looks. 2 cocktail I highly recommend, Tiger Tonic* I think that was the name, which has tonic ice cubes, it was a bit on the sweet side. Perfect for ladies. Japanese sidecar hands down was the best cocktail I had in awhile. For almost all the Michelin restaurants, you really can't say much about the food because is hard to express the flavor by words and even by pictures. This place is worth the money, and worth your time. Book it and go try it."
"chicago","Acadia","DosDragones","380581BB011C8709B941F23BFA8BCBDF","en","New York City, New York","5","September 26, 2016","Fine Dining...Off the beaten path","The driver was confused when we gave him the address. We arrive in front of subtle building next to an active dog park. Inside...a creative meal with regional ingredients and perfectly paired wines by Ben Meyer. Ryan McCaskey is well on his way to his third Michelin star. Bobby Schaffer is a brilliant pastry chef. "
"chicago","Acadia","giovannig506","E88B894A3682E4C01F79B25ABD1BE905","es","(null)","4","September 26, 2016","Buena experiencia no impresiona","Comida especialmente minimalista. Buena experiencia pero si eres de gran comer no vayas al de 5 platos sino al de 10. Para el costo no le impresionó. Excelente servicio y selección de vinos y licores. Recomiendo ir una vez pero yo no regresaría. "
"chicago","Acadia","DadofAMT","65417FCD433B89E86F269B3665323FB4","en","Chicago, Illinois","4","September 5, 2016","Was not impressed","I was truly expecting to be blown away given the reviews and maybe that is the problem. We ate at another restaurant the night before and were blown away by that. I have to admit, I was upset about the whole lead up. We had reservations nearly a month in advance for Sunday for a birthday celebration. A week before they called and said they were suddenly closed for maintenance. How was that not anticipated? Strange how that happened considering they require you to purchase tickets in advance. Katelynn went to a lot of effort to reschedule with another restaurant and fit us in for Saturday but it was an inconvenience given we had guests flying in from out of town. No other accommodations were offered for the inconvenience other than we could cancel. HmmmmIn total we added 5 drinks to the tickets, one more wine pairing and a Wagyu beef dish that somehow added $250 to the prepaid bill.Now on to the food and service..the melon dish was bland and unimaginative. Molecular gastronomy and agar are passé unless the flavor was intense or unusual because T this was boring. The Wagyu beef was warm and not hot and we had 4 to share ( they said that was ok) but there were only 3 small pieces for $85.But thank god we ordered it for our 5 course meal because that was insufficient but due to our late seating were not able to order the largerTasting menu (in hindsight, glad we didn't). They were not even aware of which tasting menu we ordered and asked us despite ordering this well in advance. Poor communication. Water glasses were not filled through the evening. While you might expect this at a lower caliber restaurant, we found this surprising. The lobster roll was good but not exotic or innovative. The chicken was tepid and had an unusual consistency. The cucumber frozen dessert/intermezzo pictured below was novel but I have to say that I can't remember because they never offered us a menu as a souvenir as is so typical of restaurants of this caliber. Cardamaro was one of the wine pairing offerings and actually delicious but at a cost of about $15 a bottle, not something you would expect from a 2 star Michelin restaurant with an $85 wine pairing. On top of all that, it was a birthday celebration with nothing special to truly mark the occasion. I feel I'm being generous in giving 4 stars but not interested in ever returning. "
"chicago","Acadia","Jeff R","D79235B0C1B7B163E234E9FB3E1143B6","en","Libertyville, Illinois","5","August 30, 2016","Hard to find exquisite fine dining experience","Passed the restaurant twice as the outside is rather unassuming. Once inside, you are in for a unique dining experience. The food and wine pairings are sure to please."
"chicago","Acadia","Kallen C","E250F75526A52F0922CF8814648A726F","en","San Mateo, California","5","August 22, 2016","An excellent dinner","Every dish on tasting menu was well prepared, tasty and well presented. Service was right on inside a beautiful restaurant."
"chicago","Acadia","travelguy9119","E736B1EB647B237F237042C00B9B3967","en","Minneapolis, Minnesota","2","July 31, 2016","Wine pairing a total ripoff","This is easily the most overrated restaurant I have ever visited. How this place ended up with two Michelin stars is beyond me.I have visited a multitude of Michelin starred restaurants around the world and this is by far the worst. The restaurant itself is quite bland in appearance. The service was just OK, but given you are required to pay a 23 PERCENT GRATUITY IN ADVANCE one might expect more. 23 percent. In advance. That's pretty aggressive by anyone's standards. The food was nicely plated and good, not great. Certainly not two-star worthy. But where Acadia truly failed is in the wine pairing. The shortest pours I've ever seen. I'm not looking to get smashed at one of these, but for $85 you got little more than a glass of wine (five pours). The wines themselves were good, I really wish I could have enjoyed them. To top it off, the somm had a jacket full of smudges and stains. At a two-star restaurant, you really need to have your somm in a decent looking jacket, don't you think?Acadia just picked up its second Michelin star this year. Not sure how on earth that could have happened, but I think it's going to put a lot of undue pressure on this place. Expectations are going to be very high. And Acadia will not live up to them. I wondered why it was so easy to get a reservation on a Saturday about two hours before I visited. Now I know..."
"chicago","Acadia","Ana F","09912081BA49EF5BE2B6270E6B6C3BDB","pt","Porto Alegre, RS","3","July 31, 2016","Esperava mais ","Esperava muito mais desse restaurante. Achei a comida sem ""alma"" e pequeníssimas porções. Destaco um drink com lima, lemongrass e lavanda que salvou minha experiência lá. "
"chicago","Acadia","puma1954","1FE1C620D1E6571095C3A31E6F2B7681","en","Wheaton, Illinois","5","July 31, 2016","Amazing!!!","My husband and I came here as part of a Chase Sapphire dinner experience and it was amazing. We were able to meet with chef Ryan McCaskey and he was great in answering questions and talking about the history of the restaurant. The food and wine pairings were an experience to long remember. The selections were unique and delicious and the wine pairings were perfect. The presentation of the food was beautiful and each a work of art! Every morsel of food was a symphony of flavors ! The room was beautiful with a feel of calmness so your focus could be on the food. We will definitely be back!"
"chicago","Acadia","harfster","92B4C514770129C012C16E775BDF4E17","en","Chicago, Illinois","5","July 30, 2016","Fine Dining at its Best","Aside from 42grams, maybe the best fine dining experience I've ever encountered. Was supposed to be 10 courses, but was really 15-16. Incredible meal. Great service. Tons of ""wow"" moments. Highly recommend. Was not hungry at the end unlike many fine dining experiences I've had. If you can get in, it's worth it..."
"chicago","Acadia","jordanharris","1C88A6D54ED8CCFC0FD28F227FBD4148","en","Oklahoma City, Oklahoma","5","July 29, 2016","Stunning","As I expected, the tasting menu was phenomenal. The cocktails were excellent and we left full and satisfied. The staff was professional and courteous. A great way to celebrate or just to experience culinary perfection. "
"chicago","Acadia","89richy","C44B4DCCF07603492B639EE35ADC1B48","en","(null)","3","July 24, 2016","Early dinner","The interior of the restaurant was very well-appointed. Quite impressive, well-lit and spacious. Got the full tasting menu. Food was 'clean' and mostly 'safe'. No 'Wow' courses. Good but not exciting. Nothing to really elaborate much on.Service was friendly, polite with no airs or snottiness and, for a good part, competent. However, it was not as smooth or faultless or as well-choreographed as, let's say, Grace. A bit rough for a 2 Michelin-star restaurant actually. Perhaps, they should hire the folks who trained the staff at Grace to give them a seminar or two. To be billed a 23% service charge beforehand (as the reservation had to be 'bought' and fully paid for prior to the visit),I would expect a service that's impeccable and definitely way above what I experienced.Am I going back? With the glut of options around, unlikely."
"chicago","Acadia","778sunnyc","2197664F4414ADAF0A281E447E077129","zhTW","Songshan, Taipei","5","July 22, 2016","精巧、值得細細品味的米其林餐廳","想不到這頓晚餐真讓我們吃了四個小時，但席間絲毫不覺得時間漫長，因為上菜速度掌握還算得宜。雖然我們在空檔聊天時不免開玩笑説會吃不飽，但其實在視覺和味覺上已獲得很大的滿足！每道料理上桌時，服務人員都會特別做說明，而在最後用餐完畢要離開前，接待人員遞上了當日MENU給我們（做紀念吧？）詳細介紹了每道料理的內容。感覺上每道料理都美得像幅畫。名為""The Garden""的沙拉，擺盤真的像可愛的花園一樣；我也喜歡那道以Summer Melons主題的開胃湯，非常爽口。而主廚對甜品的安排也很用心，從清爽到甜而不膩，依序上桌。尤其第一道甜品-黃瓜雪酪，非常清甜。跳脫以往我們對雪酪和甜品的想像。原以為嚐到巧克力夏莓冰淇淋時就該完美ending，想不到還來一顆更甜的芝麻太妃糖，就像在休止符之後又補了一個可愛的彈跳音！"
"chicago","Acadia","742miked","11CCDF2208249B1F544A6494F71DD101","en","Chicago, Illinois, USA","5","July 13, 2016","Unique 2 star restaurant that goes beyond the food. The entire experience is truly great","When you walk in you notice that the seating is quite open, they could probably have had more tables but that is what makes this such a personal experience. The food is truly inventive, wonderful mix of flavors that are intensely individual and work together in new combinations. The staff is outstanding. The service is very attentive. Most notably is how knowledgable they al are and how personable they are. This gives Acadia a true sense of a soul, rather than an institution. This is a sleeping gem because it is a little out of the downtown area. Definitely worth the trip and you can boast a ""real find"""
"chicago","Acadia","Robert H","538B7D35B72280491F9DF5CFE405F1D1","en","Sydney, Australia","2","June 27, 2016","Not up to par","This restaurant was on our radar for Chicago and we booked months in advance from Australia. I'm not concerned with the building, or the outside door, as the food was what we came for. In that respect, it was an enormous let-down. We opted for a 5 course dinner. Service was friendly if unpolished. At times we saw the waiters make 'false starts' as one let his station slightly before the other as they attempted to synchronise their table movements. The food was passable but not up to par and in short supply for our liking. Perhaps this was an off night. However, when four people pay USD 770 - over 1000 Australian dollars - plus tip for dinner they expect to be fed! What else can I say? I so wanted to have a good dinner here and bought into the local boy makes good line that is fed in the restaurant backgrounding. As a family, we like to support local fine dining whenever we travel and this regrettably was the first time ever that we walked away disappointed."
"chicago","Acadia","rabbit h","4543FCF83648F2F0DE96234D2CE6C668","en","San Diego, California","5","June 22, 2016","2 Michelin Stars Restaurant","We actually ate at the bar (restaurant is too expensive for our budget) - the drinks and the food were wonderful, great taste, presentation, service... what else would you want from a restaurant?... hmmm, maybe location?.. well, location of this place is kind of funky, i must say: the restaurant is nearly unnoticeable, and the door, entry door, is VERY hard to open (we thought the place had another entry and went to look for it because we could not get that entry door to open, and apparently we were not the only ones doing that...) Ambiance (again, at the bar) is very sparse... it's all about food there."
"chicago","Acadia","206marcusf","170FA53E8FA9DC541DB230A96E5AED90","en","Peoria, Illinois","5","May 21, 2016","Wow","My wife and I ordered off the bar menu for our anniversary last night. She has the lobster roll and loved it. I had the tuna tartare with the truffle polenta. It was the best food I've ever eaten. Everything was perfect and delicious. The service was great. The place was gorgeous. I'm going back the next chance I get. All the stars. "
"chicago","Acadia","Oliver S","106CD145F8BD58743CDE936071F2EDC4","en","Hamburg, Germany","5","May 20, 2016","Two really true Michelin Stars","Been here for a private dinner in May 2016, also posted a picture of the menu we had, so I wont go that much into detail about the courses.The restaurant is in the south loop in a really unfancy building close to a children playground. But once you enter, you know that you are right.The bar is in front of the building and decoupled from the dining room, so that the people waiting do not disturb the privacy while dinig.The service is even though we had overall 6 different waiters along the night really good, sophisticated and knowlegable. I would say ""as expected"" but that is always not really fair compared to the high standard that is delivered here.We had 4 different ""greetings from the chef"", all in excellent quality and taste. The first courses nearly flew at our table and after 20min we had already passed 3 courses. Once we notified the waiter to slow down a little bit, we had the right speed of food and service.The overall dinner had 11 courses, we also took the wine pairing with really interesting stuff included ( the sake was the most interesting one ) and left after an incredible good dinner after 4,5hrs.The design of the courses, combination of taste, quality and variety of ingridients is worth the money. Even though we paid 175$ for the large tasting menu and another 125$ for the wine pairing I would truly say: its worth it.Go there if you are up for a really good Michelin star restaurant and have time for a special dinner event.Don't go there if you simply wanna get a dinner and be saturated 60min later, that´s not worth it and is also disrespectful for the people that work really hard in order to make this restaurant and its food a special one."
"chicago","Acadia","Sanford S","C2350E86DD5B8FB5F2EB11576CC62918","en","Chicago, Illinois","5","May 12, 2016","Inventive platings, exciting flavors, but know what to expect","We made our reservation after reading the Chicago Tribune 4-star review. I did not realize until well into the process that on-line reservations are prepaid and non-refundable. Since we went on a Tuesday, they were not overly busy and a phoned-in reservation would probably have worked fine.We did let them know (on the website) that it was pour anniversary and they presented us with complimentary sparkling wine to start. We opted for the 5 course tasting and had the wine pairings. They also served us 3 ""pre-appetizers"", a pre-dessert and little cookies after; so our total was 10 different dishes.As noted in other reviews, the portions a very small. However, the intensity of the flavors and the exquisite platings (this is the first time we photographed our plates at a restaurant) more than compensate. The wine pairings were well-chosen and described. The pours were only a couple ounces; so despite drinking six different wines we were in no way impaired (or over-full) when we left to drive home.The service was exceptionally competent. Even though one of our servers was on his first day he was clearly a well trained part of the team.The negatives: although safe, this location is several blocks south of the trendy South Loop restaurants. The entrance door is very hard to open. Our initial table was wobbly and their efforts to stabilize unsuccessful; so they moved us to another spot. Their was large puddle on the floor of one stall in the mens room which I had to bring to their attention."
"chicago","Acadia","GrangerGuy","4A3ABC4E4B4BB2B809144B3EA947709F","en","Granger, Indiana","5","May 8, 2016","Lived up to the hype","My wife and I celebrated our 3rd anniversary last night at Acadia by indulging in the 10 course tasting menu and wine accompaniments. And what a celebration it was! It took over 4 hours for our experience to play out. Tremendously creative and tasty course after course made the time seem to fly. We had one minor glitch with our service after 'the main course.' It took about 10-15 minutes for our plates to be cleared, before our 2 dessert courses. Otherwise our service was impeccable. And that main course, Indiana rabbit, was especially good. Overall, a wonderful evening. Highly recommended!"
