"city_name","rest_name","screenname","member_id","review_language","user_loc","rating","review_date","review_quote","review_text"
"chicago","42 Grams","U6807ONmarinas","DC53F423AB3C0FAF4A6B863F7A6772C9","(null)","Zaragoza, Spain","5","May 14, 2017","Originality, kindness and good taste. Exquisite.","I was more surprised than I expected. The restaurant was small but with really well used spaces. Jack and her wife explained us the story of how the restaurant became a reality. They were very kindly and friendly.And of course the food... excelent. I have no other words but excelent, tasty and beautiful.It's important to make a reservation with enough time because the place it's just for 10 people. You choose being in a table or in front of the stove, which I recommend. A great experience, no doubt."
"chicago","42 Grams","lanceemery","BBE796D80E259E08C2B8E6658C4DBE34","(null)","Chicago, Illinois","5","March 25, 2017","Unbelievable meal, phenomenal experience - our new favorite in Chicago","Our dining experience actually started even before we arrived. Alexa, one of three employees at 42 Grams, called us to make sure we were still coming. When I said we were right outside getting out of a cab, she was waiting for us outside to welcome us in. This is a VERY PERSONAL dining experience. You will either have 8 people sitting at the chefs counter or 8 sitting at a table - THAT IS IT. This is not your everyday restaurant with multiple tables. It is truly an experience.With every dish that came out from Jake Bickelhaupt, Alexa provided a wonderful back story. The dishes are going to change so it isn't worth telling you about all 14 courses other than to say every single one of them were unbelievable. The portions are just big enough to give you a wonderful taste but small enough that you are not stuffed by the end of the fifth course.42 Grams is no longer BYOB and they have a small wine list but it is fantastic. Alexa does a great job of helping pair the wines with the courses that you are having for the day. We ended the evening chatting with Alexa and Jake - it truly is that intimate. How many restaurants give you a one-on-one experience like this?? None! We have dined at all of the best restaurants in Chicago. This is now our favorite and we love that it is in our neighborhood. Thank you Jake and Alexa for a wonderful meal - we will definitely be back again and again!"
"chicago","42 Grams","GL875","1F079D116E810028AA0DA2961C7B9E7E","(null)","Houston, Texas","5","December 22, 2016","Best meal we have had","My wife and I have been fortunate to dine at some amazing Michelin-starred restaurants in Europe and 42 Grams is hands down one of the best meals we have ever had. Each dish is tremendously creative and very well thought-out. The husband and wife team who run the show at 42 Grams have certainly worked very hard to earn their two stars! In addition to the amazing food that Chef Jake serves his guests, he and his wife Alexa go out of their way to make you feel like you are having dinner in their own home. With only 8 total guests at each seating, you quickly become friends with the other guests which really adds to the atmosphere. We visited 42 Grams on a quick weekend trip to Chicago to celebrate our anniversary in October. We could not have been more happy with Jake's creations and the overall experience! "
"chicago","42 Grams","Rptipple","A8093AA5F2816421631850A1ED5C7E8B","(null)","Ostrander, Ohio","5","December 10, 2016","Fabulous!","Absolutely enjoyed each of our eleven courses, Jake's ability to pair ingredients, flavors and textures was uncanny. Alexa guided us through each course and we truly felt as though we were dining in their home."
"chicago","42 Grams","taiya2015","75693094272CA2B4B53025DF9902D3F5","(null)","Chicago, Illinois","5","November 27, 2016","fantastic culinary experience","For a two michelin star restaurant, this place is unusually understated. Its located in the so so area, the setting is very simple and the service is provided by the chef""s wife Alexa, who hosts and serves all 8 guests. But what it lacks in the usual ""luxuries"" it totally makes up in the quality and quantity of all ten courses. Every dish was bursting with flavors and of excellent quality. Of the two chicago restaurants with two michelin stars, 42 grams is much superior as far as the culinary experience."
"chicago","42 Grams","Vnegs","9268FE2BE5A72CC89345E7051166A6BE","(null)","Berkshires, Massachusetts","5","November 19, 2016","Couple of nights in Chicago","When I knew I would be spending a few nights in Chicago, I immediately began thinking of where I was going to have an amazing dinner. 42 Grams was on a short list of places I wanted to try in this great food city, and it surely didn't disappoint.I like the story, I like the concept, I like sitting at kitchen counters and watching a talented chef spend so much time cooking me dinner.The 11 course fall tasting menu is what I had the pleasure of enjoying. A progression of courses starting from the sea, and ending with dishes from the land.Each plate was very luxurious and unique in execution and presentation. Hats off to the chef on his balance of textures and flavors, he has clearly spent years perfecting this skill set.I hope to one day return with my wife so she can enjoy this creative culinary experience."
"chicago","42 Grams","RiaVDB","15981AA93257EFA03CADDDAF2E82953F","(null)","Brussels, Région De Bruxelles-Capitale, Belgium","3","November 13, 2016","how did this place earn 2 Michelin Stars ?","The major ingredient this restaurant is lacking is warmth, in every aspect of it. The reception by the hostess (wife of the chef) is friendly but cold, Then we were also cold in the restaurant. And every hot dish was served lukewarm, which is a real shame. The chef is good and has some magnificent creations, but I never had the 'waw' factor. Creative, and special ingredients, of top quality, tasting very good but not exceptional, not the quality I expect from 2 Michelin stars. I dine in Michelin star restaurants across the globe and I can compare. Being from Europe, we are not used to BYO. Upon walking in, I wanted to hand the bottles to the hostess, she gave them back to me and said ""we will do this later"". In a Michelin star restaurants, I expect a courteous answer and I expect them to take the bottles, even if it is not the way this is normally done. Also, we notified 3 days ahead 1 person was not eating foie gras. The reply was we offer omissions but no substitutions. If I pay 250 usd per person for a meal, I expect service and should be offered a substitution. Again, service unworthy of a Michelin star. The hostess acts as a robot and is totally unfit to be in hospitality. The chef cooks in front of the counter - 8 seats - which could be fun if he interacted with the diners. He is shy and does not speak. This is of course OK, but I do not understand why you run a restaurant for a small audience, which looks like you are receiving people in your living room, and then you do not say a word. The hostess explains every dish to the 8 diners, but she sounds like a tape. My conclusion, definitely not the right value for money. Good but not exceptional food, and service which does not make you feel welcome."
"chicago","42 Grams","Itinerant_Foodies","EA220E3CD4427C904068595AE319C176","(null)","Greensboro, North Carolina","5","September 22, 2016","Still Outstanding!","We were incredibly impressed the first time we dined here early in 2015 so we returned and we were equally (if not more!) impressed. The various dishes in the tasting menu were all experimental in the sense that they explore facinating combinations of ingredients and preparations. But the selection of ingredients is not facinating just to be different for its own sake. It's because the characteristics these ingredients bring the entire experience to the pinnacle of fine dining.This is undoubtedly one of the best restaurants we have ever experienced.As we mentioned previously, it's not a business dinner. This is for foodies or people who want to expand their culinary horizons.And it's communal (whether at the table or the counter) so it's not romantic in the traditional sense of a very quiet table with a great view. However, the combination of the food, the other diners, and the hosts make it a very interesting experience that will give you plenty to discuss both during the meal and afterwards. An unforgettable experience."
"chicago","42 Grams","harfster","92B4C514770129C012C16E775BDF4E17","(null)","Chicago, Illinois","5","July 30, 2016","Fine Dining at its best - maybe the best in Chicago","Many have reviewed 42 Grams in depth. I went for a 5:45pm seating. Everything was phenomenal. Unlike many fine dining experiences I've had, I didn't have to go to Shake Shack afterward. Waygu Beef preparation was out of control good. Desserts (all three) were incredible. Amuse bouche was fantastic. This is one of my top two (proper) fine dining experiences so far in my life. I'll let my pictures speak for the incredible night that was, 42 Grams."
"chicago","42 Grams","KennethPages","85A05569EFBC9DC4559FD91274A5DFDD","(null)","Tampa, Florida","5","July 4, 2016","2 souls indeed","These are heavenly souls and a heavenly meal. Like the best meal your friends ever made and no work on your part other than bringing a couple of bottles of wine. It could be this was the best meal I've had factoring in many variables - and ignoring rib-fest and CTA construction. Booking a table was easy via the website. Payment was all inclusive and in advance so absolutely no surprises. Suggestions for which wines to bring were well in advance and very clear. Husband and wife team seem a great match - he is a man of few words (maybe none on our visit) and she is expressive and approachable. The influences are distinctly Asian with a touch of Midwest sensibility. Portions were good for a tasting menu of 10+ courses and only rarely did it seem rushed. It seems inappropriate to give away any of the experience. all courses were surprises. They have a ""signature dish"" so I'll tell you that - A5 Miyazaki Wagyu. Thanks Jake and Alexa - until we meet again. Also, for Michelin followers - I think this was about the least we paid for a Michelin restaurant. Really worth every penny. "
"chicago","42 Grams","Lily603","72A4F5880BC781D40121E27464D19E89","(null)","Boston, Massachusetts","5","June 27, 2016","Truly Unique Experience","The Michelin stars speak for themselves, but if for some crazy reason you are still undecided here's my opinion: More than any other meal I've had, this truly felt like an ""experience"". And I mean that in the least pretentious way possible. The open kitchen, small staff and intimate dining room create a really friendly atmosphere. Alexis is a fabulous, down to earth hostess who takes the time to describe each aspect of the dish as well as how to eat it (intended to be one bite, etc.). The food is unreal, equally beautiful as it is delicious. It is very apparent how much creativity, detail and heart goes into each dish. It should be a must for both Chicagoans and anyone visiting the city."
"chicago","42 Grams","FineWine58","3BF54A8D163A3B0405C89B16F6BC7CB9","(null)","Chicago, Illinois","5","June 13, 2016","Easy to see 2 Stars!","What a fabulous ""dining experience""! Place seats 18 but they only take 8-10 at a seating. Didn't read that anywhere before. They used to do this in there apartment but decided two floors of stairs was probably not a good idea so now it's in the ground floor with a new name. Super creative food with textures, flavors, colors, and secret surprises in every dish! Alexa serves and explains each dish. Husband Chef Jake takes meticulous care in placing each component carefully in place, along with his assistant Chef. For us, it was a bit fast paced and I would have slowed it down by 30-45 minutes but I get it for the next seating. A total of 8 sat at the bar for the first seating and then we all left, they cleared the bar and then sat the second group at the table, I was told. We didn't see the second seating,milk let due to the delay in timing it. I missed two pics but included the rest."
"chicago","42 Grams","Can't S","A554B87ACC605347E0CABA9CDBB60A71","(null)","(null)","5","April 19, 2016","Unique and DELICIOUS","If you want delicious, extraordinary food and a more formal atmosphere, head to Grace or Acadia. If you want to feel like you are in a friends home, and you can let loose a little def check 42 Grams out. I'd say arguably the food here is even better than Grace and Acadia. Some people will really enjoy the more casual atmosphere. I certainly had a great time, and its nice to have some high end restaraunts that are more casual along with the more formal ones.The chefs personality really shines through his mouth watering, gorgeous food. And a great thing about this restaraunt is that the head chef is right next to you preparing your food, so if you have any questions you can just ask. Several courses were just the perfect combination of yummy, beautiful, and unique. In particular, the lamb dish, the miyazaki, the dessert, the squab, the mussels, the shrimp. Can't recommend enough. Least stuffy and least corporate restaraunt you will ever go, and possibly the most delicious/"
"chicago","42 Grams","sugarkenzie","71C29BB6F7F2477F80296ED28F8FC525","(null)","Chicago, Illinois","5","February 19, 2016","Intimate atmosphere and exciting food","This is a dining experience in an intimate setting. There are only 8 or 10 diners per seating and only 2 seating per night. You can be as dressy or as casual as you like. As it is a more intimate setting, it is possible to get to know your fellow diners... or not, no expectations either way. The food is innovative, whimsical and delicious... it is on par with Alinea (if not better).Alexa and Jake are a lovely couple. Alexa made us feel welcomed and Jake fed us well. We had an opportunity to chat with both of them throughout and after the meal.BTW, it's BYOB. Bring what you love to drink - a bottle of wine or a 6 pack of beer per person."
"chicago","42 Grams","andieensuisse","F91ACD084103B8E133ED05E9D39BEBAE","(null)","Saint Louis, Missouri","4","January 22, 2016","Interesting textures and delicious flavors with gorgeous plating - atmosphere lacking","If you are a foodie who gets excited by unexpected and interesting flavors and textures- dining at this restaurant is a great way to spend a couple of hours - once. The atmosphere was not at all as expected and, in my opinion, took away from the overall experience - I really can't see myself returning. The seating was a tad too close, one of the stools was broken, we did not have any interaction with the chef, and a little too much interaction with the hostess. Here's what bothered me the most - and I know this may not bother some people in the least - the fact that many things being plated were being served from, re-heated in, or poured from plastic containers. I know it was necessary to prepare many of the ingredients in advance, but using cheap plastic containers to store, heat, and plate from (especially when your customers are sitting right in front of you) is strange. There are a few things that I store in my refrigerator at home in plastic containers, but I would never re-heat food in them or place hot liquid in them!"
"chicago","42 Grams","PeeJayonthego","DCDE57B3BD1C989FAB4577EAB45FE222","(null)","(null)","5","January 2, 2016","Amazing Dining Experience","This review is LONG overdue. In short, the best high end meal I have enjoyed in Chicago. Each course was memorable, service was amazing and it was worth every penny (approx $210 pp). Reservations Reservations can be booked online which also requires payment. When booking, you have the option of selecting the chef's table (counter top seats where the magic happens) or communal table (lower seating with a slightly larger group). You will note the chef table seating and communal table times differ. Meaning you will enjoy your meal with 8-10 ppl tops! Very intimate.BYOBYou are provided sparkling or still water. All other beverages must be brought in. What distinguishes this place from other BYOB Michelin rated restaurants like it ----- is that about 48 hours before the meal, an email was sent with wine pairing recommendations for each course to be prepared during our dining experience. It was three of us, so we opted to each bring one bottle from the list and share. I also picked up the Allgash Curieux a/k/a beer (yes BEER) suggestion for dessert. Ultimately, this was more than we could ever drink especially when planning to drink beverages paired with each course. Meaning we offered our drinks to the five others dining at our sitting and they ending up doing the same. .... Our dining experience lasted about 2+ hours.LocationThe exterior of the building is less than flattering. There was no valet parking and no parking lot which is pretty on par with all the others too. What matters is the inside. Cute! Even the bathroom was cute --- and had I brought my phone during my ""visit"", I would have took a picture. 42 Grams is located near Demera Ethiopian Restaurant. ..... GPS brings you right too it and so will a taxi. Lol BackdropIf I recall correctly, the chef and his wife are the heart and soul of 42 Grams. Speaking of souls, I think the name selection is because a soul is 21 grams and times two - get it?! The chef is fond of Graham Elliott and prepared a course inspired by him and used plates from his restaurant to accompany the course tribute to GE. Dining at the chef counter allowed us to see each course being prepared and to ask questions in free form. I suspect the same could be done at the communal table but I think the counter is better suited for it. While many look at the price of this type of meal and attempt to weigh its value by the quantity/size, it does not consider this type of business is a true labor of love. The ingredients, creations and size makes this type of place unlikely to be a huge cash cow, especially when both husband and wife are it. That said, I doubt any chef in this type of setting does it strictly for the money. You have to dream about creations to succeed even at a hefty price point. Knowing this, leads me to appreciate the talent and gift all the more. In sum, if you can afford the price tag, it is a great place, particularly for a special occasion. Highly recommend it."
"chicago","42 Grams","Isa-Francis","20863CFA510F020A3FE244EB403FD38C","(null)","Montreal, Canada","4","October 17, 2015","2nd time, not as much of a charm","We had been to 42 Grams in the Summer of 2014 and were floored by the service, quality of the food and presentations, and more importantly, by the research behind every dish and their complexities.We promised ourselves to visit back again this very intimate BYOB were you sit (8 guests maximum per service) at the chef's counter for a communal 10-12 courses meal. We did in October 2015.Although the soul of the place is still intact, with very nice presentations, well-researched courses with ingredients coming from all over the world... it lacked the heart this time around.Last year, Jake (chef) and Alexa (hostess) had two people helping them, one in the kitchen and one for the service. This time around, it was only the two of them... and it did alter the experience.The whole purpose of having this setup (which they had themselves explained during last year's dinner) was to, not only be able to present exquisite food to their guests, but to exchange with them. Hence the ""communal"" aspect of the restaurant.This time around, that aspect was completely left out. Jake was so absorbed by his preparation and cooking that he never once exchanged with the guests, nor even bothered finding time for shaking our hand or taking a picture at the end of dinner. I will admit we were in for the first of the two seatings and he most likely had to prepare the 2nd seating.... but still. On her end, Alexa was always caught up in either explaining the dishes (in a rather pre-taped emotionless manner), distributing the said dishes and picking up empty plates. This prevented her from having the time to manage the guest's wines pouring, pairing (which was done the previous time). When experimenting with the dishes, sometimes you hit it out of the park, sometimes you keep coming back to your classics and sometimes, you miss. All three apply to the current menu. While the snail caviar, sea urchin and sturgeon courses were impressive... the wagyu, coffee and pallet cleanser were back on the menu as what seems to become their signature dishes, which no one could complain about... and finally, the ramen and veal courses were definitely not up to par.The overall experience remains nonetheless interesting at $250 / person (incl. tax and tip)... if the duo gets back the help it once had. If not, this becomes just another 10+ course restaurant with a view of the kitchen... without a heart... and a dying soul."
"chicago","42 Grams","Veganvessel","CB84394D566E2DD40D92EF48CA443FBA","(null)","Santa Monica","5","July 8, 2015","A Museum of Edible Art","Stay with me on this. At an art museum a tour guide takes you from piece to piece and offers some background to help you appreciate everything. That’s pretty much what happens at 42 grams. Hostess Alexa Welsh presents you with (about) 13 elegantly prepared delicacies one-at-a-time and explains why each offers more than what meets the eye. For example, the organic Irish salmon owes its melt-in-your-mouth texture to being brined in a Lapsang Souchong tea. And the sphere of dark chocolate should be tapped from the top with a spoon in order to fully enjoy the Earl Grey tea inside. Even though the food was sensational, a key highlight came afterwards when Chef Jake Bickelhaupt mingled with the guests. He told me that food is his personal passion and serving food to others is sharing a very intimate part of himself. He basically tells that to everyone by the name of his restaurant, 42 grams, which is the physical weight of two souls (his and Alexa’s). One sign that this restaurant is special is that, as of this date, it hasn’t received any Trip Advisor ratings below five stars. Try pulling that off in a fussy foodie town like Chicago!"
"chicago","42 Grams","ChristopherChicago","269AD4102F4A78A4BE84C5F51EFC1D35","(null)","Chicago, Illinois","5","July 6, 2015","Unique and wonderful evening","Our first trip to 42 Grams will not be our last. Were seated at the counter with two friends and four strangers with a full view of the intense but fluid preparation of 13 courses carried out by Jake and helper Emily. Wife Alexa serves as an emcee for the evening, making sure you're settled, have what you need and understand what you're about to eat. She was a bit intense at first but then seemed to relax as the evening got underway. The food is all simply amazing and beautifully plated. Courses came out in fairly rapid succession (I wouldn't have minded had it been 5-10 percent slower) but we were never rushed. Our total experience lasted about 2 1/4 hours. BYOB is an interesting way to economize and allow folks to bring their favorite wines. You will keep telling yourself ""we're in Uptown?"""
"chicago","42 Grams","AlWalavich","EB2B5209AF1DFF0292F27EA37F865239","(null)","Chicago, Illinois","5","June 14, 2015","A Culinary OMG Moment","Having just arrived home after taking a dear friend out to celebrate her '0th birthday, I must let the world know that 42 Grams is a most amazing experience that is absolutely spectacular.We were at the early seating where we all sat at the counter and had a view of the preparation process, and I would highly recommend this as watching the prep added greatly to the experience.Each of the 14 courses was explained by Alexa, chef Jake's wife who also serves as hostess, who had a delightful forthright way of explaining the ingredients and hinting at the effect of the course.I think of myself as being a somewhat adventuresome eater while my guest is a bit more traditional and conservative, but both of us moved from course to course with absolute delight.Some of the ingredients seemed a bit on the unexpected side, but the blending of the tastes was fantastic. The amazing thing was that each of the courses was distinctively different, but the flow of the evening was never jarred by a discordant element.Yes, the restaurant is pricey and the reservation process might be a bit off-putting, but it is fantastically worth it.Reserve, go and expect miracles of dining pleasure. One doesn't get 2 Michelin stars for nothing--especially if you are a new restaurant with less than two years under your belt."
