"city_name","rest_name","screenname","member_id","review_language","user_loc","rating","review_date","review_quote","review_text"
"chicago","Acadia","shellyc653","6A447FBCFDC7813D0B10DC12C387E664","en","Morton Grove, Illinois","3","April 21, 2019","Expensive and Disappointing","This was my first time at this restaurant. I don't usually eat at Michelin rated eateries so I was excited about this reservation.My spouse and I were here for the Easter brunch buffet. In general I don't like buffets for many reasons. Nevertheless, based on reviews and the Michelin rating I thought the food here would be upscale and the menu would include items I have not tried before. There was a practical but limited selection. It is better to have less that is prepared well than more that is substandard. The quality of most of the food was good. The potatoes and mac n cheese were very good. The take on chicken and waffles was interesting. The sausage and bacon - standard issue nothing special. The lobster benedict was okay. The cocktail shrimp and crab legs were good. There was also ham and lamb which I did not eat because I don't eat either. There were some 'luxury' selections like foie gras and caviar but I just don't like the taste of either so I passed on those. I did not understand the rice or pasta selection. Let me preface my service comments by saying that the omelet station was manned by a very nice young man and the omelet was good. I also had a conversation with, who I believe was the head chef. He was a nice man who took the time to speak with me briefly even though he was busy. I appreciated his time and gave him my thanks for working so hard on Easter. I would also like to say that water was filled consistently. My issues with this restaurant are as follows:- Wait staff - some not as good as expected. The restaurant was very busy because it was Easter and our waiter did not seem very attentive. I believe the waiter's assistant or 'valet' was annoyed because he was overworked. I asked for a cup of tea with honey and after a wait he came back and said he would try to find some. Okay - so as not to 'over work' him further I asked for sugar instead. He comes back with 4 packs of sugar substitute. I don't use that so I ask for 'real' sugar and I guess he had to go search for that as well. He came back with some very old looking sugar cubes. Okay. Then I had to ask for more hot water. We ordered two mimosas but were never asked if we wanted another round. I asked for a clean napkin - never got it. I felt like I was being a burden and the atmosphere at times felt 'hectic' and 'chaotic'. Disappointing for a 'Michelin' rated eatery.-A la carte buffet: All drinks expect tap water were extra. Okay so charge $110 instead of $95 and provide orange juice and coffee. Mimosa's $15 each and tea $7. Okay. Then if you want a few pasteries for the table add another $11. I really didn't want the carbs but come on. Let's keep it real. Give people a croissant and muffin and include that in the price. Dessert: one small piece of the desert of the day-no selection. Everything is extra. It's all about the dollars. - The check: I know that these types of eateries are expensive. I don't typically like 'fru fru' or uppidy places. I'm very down to earth but I do like well prepared food. With that said my spouse did not want me to see the bill and for good reason. In addition to the $95/pp, we had to pay for all drinks, the 21% automatically added gratuity, tax and get this 'health insurance."" In my lifetime I have never seen a restaurant charge for health insurance. If we are talking about a stellar staff okay, ask my permission first, then I'll pay. However, I want to pay for what I get. 21% off the top without getting feedback from the customer isn't fair. I always tip at least 20% if the service is good. On top of gratuity the restaurant owner wants us to pay for the staff's health insurance. I can do if everyone is friendly and doing their jobs but if they are acting like they don't want to be there, they are inattentive, or a bit arrogant then we have a problem. After seeing the bill all I could say was 'WOW"". That's bold. In summary I can't recommend this restaurant because for me I don't feel I got the 'experience' paid for. There was much lacking. We had to wait 15 minutes for our table and the car valet was no where to be found. Please research restaurants that require you to pay for your meal upfront because you will get charged even if you don't show or try to cancel. Also review their billing policy if available online. I don't recommend going on special occasions because the place gets crazy busy and you don't get the individual attention you'd expect.The staff spends more time with customers who buy additions, liquor, etc. The more you spend the more attention you get. I think that's sad because some people don't drink alcohol."
"chicago","Acadia","jcwbesq","1D465290BB2A6001150BA672EBDAC547","en","Minneapolis, Minnesota","5","April 7, 2019","Birthday Dinner in Chicago","Have enjoyed many wonderful restaurants, this place fitting right in as rated. A two star Michelin rated place (was told working hard for the third), it’s presentation, staff and function fit the bill. We scheduled a wine pairing with our courses (very good way to go here). The food was excellent. Understand, I have never liked every dish prepared at this level (and my wife and I have enjoyed a dozen or more of this level of restaurant around the world), yet here as expected, each was explained, was unique, well thought out, intricately presented, fresh and enjoyable to experience. The best individual table experience we’ve experienced was in Bilbao at a three star, and the difference I can now clearly see. Regardless, the experience and service were exceptional. We were enabled extensive accommodations, taken to the kitchen, met the chef, took pictures and were treated absolutely wonderfully. Highly recommend this place and hope to see the refinements to get that next star. Enjoy"
"chicago","Acadia","Eszter C","D70AFDD9A667533CAF4E8DF9C496C72F","en","Columbus, Ohio","4","March 27, 2019","It was great, but not our favorite","My husband and I visited several Michelin starred restaurants and were curious about Acadia. We went there to celebrate my husband's birthday. It started with the gracious welcome you expect from most highly regarded restaurants. The staff was incredibly nice and attentive, the service was impeccable. The atmosphere is beautiful, modern and inviting with elegance. We chose wine pairing with the tasting menu and everything was great ..but I have to say, for a two- star restaurant it was a little bit mediocre. We did not get the ""wow"" factor after any dish. While we enjoyed every course (Except for a cold mushroom soup), and it was better than an ordinary restaurant with a lot of creativity we decided it wasn’t our favorite choice among other Michelin starred restaurants. "
"chicago","Acadia","355gilbertv","1E2865A242617E5E4F4B180EC58204A0","en","Greenwich, Connecticut","2","March 3, 2019","Misses the point","Presentation, technique and service is all close to three stars. However, the restaurant completely misses the point, the food just doesn’t taste good. Add to this a chateau rayas at 750 a bottle that was cooked and we really just had a bad night. Go to alenia for presentation, technique, service AND great taste."
"chicago","Acadia","NadiaChi2","DF4CEB4F4508195C9E840EE557AB7EE1","en","Chicago, Illinois","5","February 18, 2019","Unforgettable experience ","All the stars to Acadia for making our 5 years anniversary unforgettable From the moment we walked in everything was perfection, everyone was so accommodating and so nice and professional,the service was top of the top and the food was a dream, every single course was its own story its own amazing taste and we loved every biteTo all of you at Acadia thank you so much for making our special day unforgettable"
"chicago","Acadia","g0atmedic","E04F5DE211AA8D5765387E4BABBC7247","en","Dubai, United Arab Emirates","2","December 11, 2018","Not what I expected from a 2-Michelin stared restaurant","2 stars because I'm holding it to the standard of a Michelin 2 star restaurant. I would probably give it 3.5 stars if it didn't have any Michelin stars.To begin, we had a reservation for four for the tasting menu at 5pm on a Friday night. We arrived about 10 mins prior to our reservation only to find that the door was locked. We noticed a couple sitting at the bar inside and there was staff walking around but we were forced to wait outside in the bitter cold until 5:02 when the doors were opened. Prior to the beginning of service, our server confirmed that we had one individual in our party who had a gluten allergy. To a preference for no gluten, but a ""I will be in the bathroom all night if I eat gluten"" allergy. Then the amuse bouche comes out and lo-and-behold it's sitting on a fried pastry shell. We ask the server if this contains gluten to which they respond they don't know and will ask the kitchen. They return to say that there is only a small amount of gluten and ""you should be fine"". I felt that if this would have been a peanut allergy, it would be absolutely ludicrous for a chef to say ""there is only a tiny bit of peanut in there, you should be fine"", but that is the response we received. This process would repeat itself again when the petit fours were brought out and one consisted of a layered chocolate tort. We again asked if it contained gluten, the server returned to the kitchen to ask pastry and then come to inform us that pastry said there was only a tiny bit of flour and that it shouldn't be an issue.Our last service issue was when our second dessert course was brought out. It consisted of ice cream, with a white chocolate sphere, and what I believe was green matcha bread. The bread-free plate was served to me and not the individual who was actually allergic. I didn't notice until I was almost done with the dish and looked around to see the matcha bread on other peoples plates but not mine. The individual with the allergy received the plate with the bread. My wife and I have dined at a handful of Michelin stared restaurants to include Alinea, Per Se, Le Bernardin, Joel Robuchon, and Boca. All in all, it was just not service that one would expect from a Michelin starred restaurant. We are not pretentious when it comes to fine dining and I have never actually complained to a restaurant because I don't think I am qualified to critique a chef, but if there was ever a time when I wanted to more than ever it was during this dining experience. As for the food, it was very underwhelming with one dish barely palatable. The standouts for me were the lobster in the Tom Kha inspired sauce (I'm a huge Thai food fan so me enjoying this was surely a given) although it's presentation left a little to be desired. The other was the main dessert course discussed above. The pasta dish with white truffle and bonito flakes was insanely over-seasoned. The truffle was not fresh and provided no savoriness to the dish, and the dish was extremely over-salted to the point that it was inedible and I like salt. Often in my cooking my wife claims that I over-salt my dishes but this dish was on another level. Lastly the Wagyu supplement for $65 was not only a waste of money but was a terribly composed dish of what is otherwise a great cut of protein. The beef was literally served between two pieces of grilled white bread accompanied by some mayo and greens with a lemon. I lost a little faith in Michelin that night as a reliable restaurant reviewer. Had this restaurant not had any stars and was a quarter of of the price I would have chocked it up to be an off night with a new kitchen possibly rolling out a new menu. However, when a restaurant has two stars and you are paying what you do, you expect to have a level of service and food that is commiserate with their Michelin rating and for Acadia, they just did not deliver."
"chicago","Acadia","Taylor B","0E2E275F65CA1957688A5DB1792ECF7F","en","Chicago, Illinois","5","November 26, 2018","Is a third Michelin star in the offing?","When chef Ryan McCaskey opened Acadia in 2011, he dreamed of establishing a restaurant that would attract rave reviews and earn a reputation as one of the best dining experiences in the country. Mission accomplished. After only 10 months, McCaskey's Acadia was awarded its first Michelin star. In 2015, it claimed two Michelin stars. In 2012, it received the Jean Banchet Best Restaurant Award. In 2016, it earned five stars from Chicago Tribune restaurant critic Phil Vettel. It also has received a AAA Five-Diamond Award. What's next? Three Michelin stars? Located at 1639 South Wabash Avenue in Chicago, Acadia is an upscale, posh restaurant serving North American dishes inspired by McCaskey's boyhood home, coastal Maine, specifically Penobscot Bay. It is open from 5:30 to 9 on Wednesday and Thursday, from 5 to 11 on Friday and Saturday and from 5 to 9 on Sunday. Like many Michelin-caliber restaurants, Acadia offers an eight-course tasting menu. It is a growing practice that my wife and I became acquainted with at Patrick O'Connell's Inn at Little Washington in Virginia. As O'Connell explained, it affords the chef an opportunity to explore and experiment with many different dishes, not just a few. McCaskey's menu included a Hudson Canyon scallop, fire-roasted cabbage, a Stonington lobster, Chinese duck, pappardelle with truffle parmesan, whole wheat sourdough, Elysian Fields lamb and lime panna cotta with apple gel, match cake and apple ice cream. For $165 per person, in an intimate and romantic setting, you can't beat a fine dining experience at Acadia."
"chicago","Acadia","Rendezvous18","B3847CDE4E841B76FE590B6E17924A23","en","Makassar, Indonesia","5","November 6, 2018","4.6 stars","I rated this place even better than eleven Madison Park because IMO this place serves food that goes in harmony so you will love it"
"chicago","Acadia","kot_in_boots","F82BC664C5A4A81C146770CDCD558D36","en","Chicago","5","November 3, 2018","Bar dinner is experience is lovely ","We walked in on a Friday evening at 6pm to find two available seats at the bar. The food at the bar was excellent - lobster roll (served warm or cold) and the peppers were to die for. The drinks were excellent too. The whole experience was casual yet intimate, romantic, and most importantly tasty. It really is a gem in the South Loop of Chicago. "
"chicago","Acadia","Paul F","762D54DE69D6291E853CDA4860C7D9B7","en","Williamsburg, Virginia","5","October 31, 2018","In a word--WOW!","I have only been to Chicago a handful of times, but if Acadia is at all indicative of the culinary scene in the Windy City, I will make it a point to come here more often. Don't be fooled by the unassuming frontage of this nondescript location. The experience within is superb, from arrival to departure. Our group was not looking for the full gastronomic experience that can be had with one of the tasting menus, after all it was Halloween, so we opted to be seated in the bar area. Our server, Nicole, was immediately attentive, cordial, and clearly there to curate our dinner. After beverage service, she returned to take our order. She was one of those uncanny servers who could tell the absolute most appropriate time to appear and disappear. I ordered a salad and a burger, but what I received was something akin to paradise. The salad was artfully constructed in a manner reminiscent of an architectural drawing with the appropriate precision. More impressive than the presentation was the delicate blending of subtle flavors, rarely found in a dish as light. The burger was anything but what the name might suggest. It was as good as any aged ribeye I have had in a fine steakhouse, and it was adorned in a complex array of flavors that left the palate in a state of wonder. If I had any criticism, and it can't really be one when ordering a burger, it was a little too rich. My fellow diners had the short ribs, lobster roll (well, it is named Acadia), fries and a small treat. Perhaps the most impressive moment of the entire evening was when Chef Ryan came out to our table to check on our meal. He was the most cordial and convivial culinarian I have ever met. I can't wait to go back and try the full dining experience. It must be unbelievable."
"chicago","Acadia","Marik84","04A56FB3BFEB8619E80F7E5B168D0ED6","en","Chicago, Illinois","4","October 31, 2018","Anniversary dinner","Ate food at the bar. Good service, tasty and decent portions. Started with oysters, followed with mussels. For main course ordered lobster sandwich and short rib. For desert foie gras pumpkin torte. Good drinks."
"chicago","Acadia","ARiosCali","7DF22B5CA741AC9B144CB560CB31EEC8","en","Walnut Creek, California","2","October 28, 2018","Easy to please","Avoid this place. You won’t hate the food but won’t love it either. Not worth the price tag and gives Michelin a bad name. Plus the service is not great. I usually love most restaurants, from French laundry and Gary dankos to chains like the Cheesecake Factory and random burger joints. I was excited to take my wife to a Michelin star restaurant during our weekend in Chicago. I called for reservations but they were booked, however we were told we could sit in the bar area and order everything from the main room. So we headed out on an hour ride there and arrived hungry and ready to try everything. Upon getting there we realized the restaurant was empty. There was only one other couple and a random single guy at the bar. Most of the people were staff. (A place that isn’t packed is a red flag but it has a Michelin star so we figure it should still be awesome). When we tried to order we were informed we could not order the large multi course menu, only a la carte. I explained to the waiter that we were told otherwise over the phone. He went to check with the chef to see if he could accommodate us but it was too much trouble, they would not. So we ordered a lot of items a la carte. The drinks were pretty but too sweet and not Michelin pretty. We ordered based on the waiters recommendations and the food was just okay. The portions were fine but the food wasn’t Michelin quality either. They used expensive ingredients like lobster and lots of truffle oil but they didn’t put them together in a Michelin quality way. Everything was just okay and disappointing. The staff raved about a burger that was the best in Chicago but ended up being somewhat insipid. The lobster roll was good but nothing I couldn’t order from a food truck. Presentation was not good. It was just all around not a great experience. The food was on par with the Cheesecake Factory, maybe slightly below, and the service definitely subpar. Maybe their head chef had the night off, I hope the owner reads this and fires the manager or chef who was there Oct 27, for the sake of his business. Anyway we ended up going to the theatre to see Hamilton and stopped by a random place next door to it with some old world charm. We ordered some food there and it was absolutely awesome. Maybe Acadia set the bar so low that anything would have impressed us by that time. If you’ve never been Michelin please don’t come to Acadia, you’re going to throw away your money. There have got to be better Michelin star restaurants in Chicago that will give you an out of body experience. I wish Acadia was one of them but unfortunately they will disappoint."
"chicago","Acadia","K1558PGjosepha","7709D55E75D407CA48EB840C39090D62","en","Los Angeles, California","5","October 4, 2018","another michelin star","great servicegood food tastegreat food presentationwould be perfect venue for special occasion / celebration"
"chicago","Acadia","L H","0AB5256A288342E11E5179D485435EEA","en","Chicago, Illinois","3","August 10, 2018","Pretentious","There are so many good restaurants in Chicago that there's no reason to settle for poor hospitality. Staff members are aloof/ungracious (they seem unhappy), drinks slightly overpriced; stinginess is in the air; salad presented beautifully, but consisted of 4 leaves of actual lettuce; burger is excellent, but served on a saucer without even a shred of garnish (also much rarer than ordered), lobster on the tough side and lacking flavor (quality needs to be exquisite with Michelin stars. Like Alinea, there's a bit of a be-grateful-we-allow-you-to-eat-here attitude."
"chicago","Acadia","Bos_DK","65AAD008BD79617608E68D74E8297952","en","Copenhagen, Denmark","5","July 14, 2018","An adventure in taste and amazing wine pairings - worth all the money","After having visited an exellent 1-star in NYC a few months before - This fantastic place topped it. The experiments with the food were just right. The service was good. What really amazed me was the Wine pairing. It added a dimention to the experience I have not tried before. Will highly recommend to everyone who appriciate gourmet food with some experimental touch and appriciate fine wine."
"chicago","Acadia","TimP549","83BADAD93117CECD6262F174B7FA923E","en","Adelaide, Australia","4","June 5, 2018","Excellent food experience","Degustation menu with matched wines was fantastic experience. Food was high quality and wines were well matched. Seven courses with some nibbles before. Always a balance when multiple course re the size versus number. Was left slight hungry at the end but some will be absolutely fine. "
