"city_name","rest_name","screenname","member_id","review_language","user_loc","rating","review_date","review_quote","review_text"
"chicago","Acadia","flowercountry2","3E4688B6AA3F8E966602AFF057DB11B6","en","chicago","5","March 8, 2015","Unsurpassed Service and Best Cocktails in the City","Acadia is one of the finest restaurants in Chicago. We have eaten there before referred by a local chef and the one place he frequents on his days off. The service is incredible. The waiter really fabulous. All of his suggestions were spot on and he had some good old fashioned stories of the city. This visit we went late at night specifically to go to the bar with friends. The drinks are arguable the best in the city made with fresh herbs and an attitude. The bartender creates a lively yet very very sophisticated atmosphere. You can get fantastic burgers and lobster rolls in the bar, while the full menu is only served in the restaurant. I promise that you will return here over and over again."
"chicago","Acadia","JohnVic_11","176A539AA0EB00FF7F3421D7EE2D6467","en","Chicago, Illinois","4","December 14, 2014","Food as art","We have favorite restaurants which we regularly frequent in Chicago and look for new ones, especially nearby, that might give us greater choices. Four of us (two couples) tried Acadia at 5:45 PM Saturday; the only later bookings available were after 8 PM.We walked there; our coats were checked and my wife and I waited in the bar area for our other party to arrive. Acadia has subdued, ""minimalist"" decor; clean, horizontal surfaces with indirect lighting (see the Acadia website). Slightly spoiling this relaxed feel was the somewhat frenetic, a little too loud, background music. We were seated at a large, square black wood table for four. The chairs are not good for dining. For one thing, the carpeting made chair movement difficult. The chairs themselves are cloth upholstered with a sloped back that offers no support when you're actually eating. Tables are well-spaced for relaxed dining.We had five different 1st courses: celery root risotto, butternut squash soup, scallops, veal sweetbreads plus the charcuterie ""for the table."" The butternut squash soup is as good as it gets; the wild boar terrine in the charcuterie was a solid chunk and crumbly; difficult to apply on toast points, but flavorful and more than compensated by a silky chicken liver mousse that was over-the-top good. The celery root risotto was different, for sure; little cubes of cooked celery root that tasted like a risotto. Not as flavorful as you'd expect; maybe traditional rice risotto concentrates the flavor more? The sweetbreads were good; tender and rich. Ditto the scallops which had a sublime white sauce, maybe pureed parsley root. I'm sure the waiter told us what it was, but every dish was unique, with a lot of components, easily confused.For our 2nd course we had scallops, lobster, ""Indiana duck"", skatewing and venison. As you can see from the Acadia website and reviewer pictures, portions are not overly generous, but very attractively presented. Acadia combines divers types of foods into a colorful ensemble that enhances flavors and provides contrasting textures. The skatewing, for example, was served on roasted cauliflower florets. The Indiana duck had beets and mustard and little curried roasted carrots (which tasted too salty). Sauces are also on the skimpy side, which is too bad because they're quite good.Parker house rolls were served as a ""bread course."" These and the accompanying whipped maple sugar (I think) butter with cinnamon were amazingly good.We all had desserts but the menu descriptions were deceptive. A ""sweet potato custard"" had these little pieces of cooked sweet potato and other ingredients which didn't seem to include custard. Ditto the gooey butter cake had virtually no cake, and the chocolate pudding cake had no pudding. They were, however, delicious. Service at Acadia is extraordinarily good. Attentive, unobtrusive waiters kept glasses filled, accurately described the dishes, answered questions (""what is that green centerpiece?""). We'd got one 1st course, the charcuterie, ""for the table"" and without being asked, the waiter got us more toast points. With two glasses of wine, two coffees, five 1st courses, four 2nd courses and four desserts, we figured our bill was about 80% higher than the French bistro restaurants we typically frequent. We'd return for sure, but it would have to be a pretty special occasion."
"chicago","Acadia","silvia  B","67639ECAA3AC7413726B5692A43687C5","it","Milan, Italy","5","December 12, 2014","Raffinata sperimentazione","Ambiente raffinato nei toni del tortora scuriti dal wenge dei tavoli lasciati nudi - cioè senza tovaglie - e dei mobili, e appena illuminati dalle tende di cordini con boule argentee; grandi spazi e tavoli ben separati; ariosità e rumori attutiti. Il servizio è persino troppo premuroso, io ceno sola e tutti dal maitre in giù mi coccolano. Lo chef è originale e creativo con poco spazio ai sapori più tradizionali. Propone una cucina sperimentale elaborata nella miscelazione dei profumi e dei gusti, ma non, come a volte succede, esasperata e stucchevole. Io ho scelto risotto alle radici di sedano ed aragosta con un pizzico di aromi giapponesi. Il piatto non è destinato a togliere la fame, ma certo soddisfa appieno il senso del gusto. Eccezionali gli amuse-buche anche se non è facile capirne gli ingredienti, ma il mistero aggiunge loro solo merito. Formaggi americani di inaspettata qualità. Il prezzo è adeguato alla qualità ambientale e gastronomica del locale."
"chicago","Acadia","Julie M","A3AF87A4BDA12989DAA488419792B28B","en","Chicago, Illinois","5","December 8, 2014","Delicious high end food, fantastic service and a great atmosphere","We went to Acadia with some friends from out of town. We are lucky to live a few blocks from this wonderful restaurant, and our visiting friends wanted to celebrate a big birthday with a great meal. We immediately thought of Acadia - an incredible wine list managed by Tristan, a menu focused on seafood (but knowing I was coming they made a special off the menu vegetarian dish for me!) and desserts that are sophisticated and complex. The service is incredible - the waitstaff is friendly and professional. And don't forget to stop in the bar - the drinks are to die for and the barman Arunas is just so good at what he does. This is a hidden Michelin starred gem - give it a try!"
"chicago","Acadia","Rhonda C","9C98D58BF7E33F7FD47BC463AF7F0B4B","en","Kerrville, Texas","5","October 18, 2014","Incredible Dining Experience","My husband and I recently enjoyed the tasting menu at Acadia. The food was absolutely amazing. The dishes were so creative and artistically served. The waiters were exceptional. They thoroughly explained each course and they told stories about the thought process or history behind some of the dishes. The chef is incredibly talented, as well as thoughtful. I have to limit my sugar intake but rarely mention this when dining out. I usually just eat what I can and my husband eats what I cannot. However, when we selected the tasting menu the waiter asked if we had any dietary restrictions and my husband told him that I cannot eat much sugar. I told the waiter not to worry but when the dessert courses were delivered I received beautiful, extraordinarily devine cheese plates. The cheese was exceptional and very much appreciated. We tried to determine which course was our favorite but it was impossible. They were all excellent. Words cannot do these courses justice. Our meal at Acadia has become one of our very best dining experiences. And, it truly is an experience. The amazing, creative food combined with the perfect, attentive service makes this a must go-to destination for foodies."
"chicago","Acadia","909matthewg","0AA3E003C8179BEA6A14BE568DC633C1","en","Chicago, Illinois","4","October 3, 2014","Difficult to find, pleasantly surprised","We were meeting friends at Acadia for the first time. Due to poor lighting and nondescript facade, we drove by it several times. We finally stopped and called our friends to get the address. Once we got through the door, we were pleasantly surprised by the atmosphere and professionalism of the the staff. It was late, so we ate in the bar which was very good. We definitely look forward to trying out the main dining room soon."
"chicago","Acadia","Taylor B","0E2E275F65CA1957688A5DB1792ECF7F","en","Chicago, Illinois","5","September 23, 2014","Chicago's No. 1 burger?","According to Tripadvisor, Acadia produces the No. 1 burger in Chicago. That's quite an achievement, like producing the No. 1 pizza or No. 1 steak or No. 1 hot dog. But, trust me, once you have tried it, Acadia's burger is hard to beat. For one thing, it looks like and tastes like no other. I'm not into Fois Gras or martinis but I am into hamburgers--as you know, I'm partial to White Castle--and when one noted restaurant rating service tapped Acadia as ""the best fine dining"" establishment in Chicago in 2013 and AAA awarded Acadia a 5-star rating and another noted food critic rated Acadia's burger as the best of all...well, you have to stand up and applaud and take notice and stop by to check it all out, especially the burger. Acadia also was named one of the ""best new restaurants"" in Chicago in 2012. And Michelin, the international rating service, gave Acadia a top evaluation in 2013. Honestly, you don't receive those kind of accolades for the quality of your burgers. First of all, the burger isn't supposed to be the signature item on the menu. It's on the bar menu. At Acadia, most folks start with eggplant or oyster soup or Fois Gras Gateau, then order ribeye or cobia or lobster or Indiana duck ham. The bar menu also includes Vietnamese meatballs, mussels and lobster rolls. But chef Ryan McCaskey's always draws rave notices for his burger...three cuts of beef (chuck as the base, brisket for juciness, wagyu for scraps), housemade Applewood bacon, double creme Gouda cheese and bottomless layers bacon/onion jam and housemade garlic dill pickles with a side of potato salad. Acadia is close to the Chicago Loop. It features an elegant but understated decor, plenty of privacy if that's your pleasure, a lively bar, attentive service, not exactly the type of place you'd expect to find the No. 1 burger in town."
"chicago","Acadia","Susanne M","D8A7F57C6C3B3CE21E48083A6F34F349","en","Los Angeles, California","5","September 16, 2014","Destination Dining","You come for an incredible meal which does not disappoint. Beautifully prepared food - you DON'T want to miss the Fois Gras. The surprises are the elegantly understated décor, attentive service, quiet ambience - excellent for conversation, and bartenders serving up great drinks! A must for anyone visiting the windy city."
"chicago","Acadia","Bill60763","6BB5B6D2CCB6D8A9DE598744C70081C2","en","West Yarmouth, Massachusetts","5","September 8, 2014","Outstanding","Acadia is handy to the Chicago Loop area. It is comfortable, understated décor, tables well spaced for privacy and conversation. The food was excellent and well-presented -- imaginatively done. The service is attentive and well trained. A nice wine list. Altogether a memorable evening. Highly recommended."
"chicago","Acadia","Li Wen H","3417A0E5C39C3A20CDFC18D039946439","en","Kuala Lumpur, Malaysia","5","August 22, 2014","Southloop Gem","The bartender is exceptional. He is very knowledgeable about the drinks and took out orders quickly as we were seated at the bar. His lively character made our jet lagged evening more pleasant. The burger was great for the price. And the dim ambiance was perfect for a relaxing night. "
"chicago","Acadia","MJN63","1F564228FFA70C993A4F118336D8E5D9","en","Zionsville, Indiana","5","August 17, 2014","Great 25th anniversary dinner!","Wow, what a special meal. We came here on the recommendation of the concierge at our hotel during a 25th anniversary weekend celebration. We had the tasting menu. Four special lead in bites and then nine very unique, well presented, well prepared and well served selections. All were well explained, interesting and innovative combinations of ingredients. It would take too long to describe all the dishes but suffice it to say we enjoyed all manner of variations. The staff were very professional and very helpful. The location is in a non-descript building seemingly off the beaten path south of the downtown area but don't let the outside appearance deceive you.The evening was not for the budget minded but if you want to enjoy a special treat I would definitely recommend. Certainly worthy of it's Michelin one star!"
"chicago","Acadia","William  G","992634BAC442E11B689876BCF862D2B9","en","Chicago, Illinois","4","August 5, 2014","Good Food Beautifully Presented in an Elegant Setting","This restaurant serves good food beautifully presented in an elegant setting. Flavors are unique, too. As one might expect from this type of locale, the portions are small and expensive. Service is excellent."
"chicago","Acadia","Cheena89","1B1DB1C839728BE84D643B9ECF2E27AD","en","(null)","4","July 19, 2014","I LOVE Lobster Rolls","On Sunday 07/13/2014 I visited Acadia for dinner, my meal was absolutely delicious !!!!!! I had the lobster roll & a Moscow mule. Since I was dinning alone I sat at the bar. My Moscow Mule was exceptional !!!!! It was the perfect amount of ginger beer, lime, & vodka. The bartender told me that they make the ginger beer fresh on location. I was very impressed, That was the absolute best Moscow mule I have ever had. It took a very long time for my food to arrive, while I was waiting the bartender did not offer me anything. I fact, he did not ask if I needed anything else and he did not ask me how my drink was. The staff overall was very pompous & pretentious. I would have given a much higher rating if the service was better and the food portions were larger. My lobster roll was on a bun that had been brushed with butter & lightly toasted. It was very moist, slightly sweet, & fresh. The lobster was fresh and seasoned well. I do NOT like mayonnaise or sand which spread so they offered to make my lobster roll Connecticut style. Again, I can not say enough that the Lobster roll was perfection. However, my dinner was more like an appetizer portion size. A miniature lobster roll accompanied with 6 homemade dill flavored potato chips. I would visit this location again for drinks only as I love a good Moscow Mule."
"chicago","Acadia","fritznig","80A73D23D965FCFCC8D2D8DEFE70CC5D","en","Sandusky, Ohio","5","June 26, 2014","Excellent","I've recently eaten at Acadia twice. Both times there were two of us. Waitstaff is very knowledgeable and attentive. The food is excellent--preparation, presentation and seasoning. I've had both the tasting menu and ala carte. Pricey but worth every bit of it. Interior is a bit minimalist but very pleasant."
"chicago","Acadia","Pierre_De_Meyts","04748C22448F912F7E4FEBB388B377C4","en","Kraainem, Belgium","4","June 23, 2014","Decent but not stellar food in minimalist surroundings","I had dinner with my wife at the Acadia restaurant on June 21st , in a rather nondescript building in a somewhat rundown section of the South Loop of Chicago. We were attracted by generally good reviews since it opened in 2012, including one star in the Michelin guide to Chicago. It did not quite live up to our expectations.There is a bar at the entrance that looks nice; the main room is so minimally decorated with bare walls, generic furniture with bare tables and halogens on the ceiling that it looks like a glorified cafeteria. We were seated in the adjacent smaller room that is more intimate with at least one modern painting on the wall and chandeliers.We started with two cocktails, which justified the bartender’s reputation as a great “mixologist”: a “Local Agent”, vodka based with onion-flavoured ice cubes, and a lemony gin tonic with cucumber-flavoured ice cubes. Both were good tasting and strong, no Shirley Temples!The background jazz music was very pleasant.We dined à la carte since we had to get up early the next day for a meeting at the Convention Center.We had an amuse-bouche of goat cheese with two kinds of beets, rather banal in my view. I had a starter of foie gras “au torchon” with white chocolate, a bit unusual but tasty, the portion was quite small. My wife had a risotto with snails that was fine. Then came a small buttermilk biscuit with soft butter that tasted OK.My main course was a Storington lobster “pie”, consisting in a piece of lobster claw and a piece of tail, both tasty, with added bisque, and a rather tasteless pastry cap. My wife had a piece of halibut with artichokes and cucumber that was rather bland. The menu has only three desserts. We had the “miel” and profiterolles that were fine.We had with this an excellent bottle of Auxey Duresse 2010.The service was efficient, courteous and attentive.All in all a decent meal, at a cost of 276,87 USD for two excluding tip, but we did not think that it justified one Michelin star. To appreciate fully the chef’s talent, we should probably have ordered the 11-course tasting menu that costs 165 USD per person (plus 95 USD for pairing wines), a good reason to come back…"
"chicago","Acadia","807debbieb","D9C29830339D38CBD591A4228A2A4666","en","Chicago, Illinois","3","June 21, 2014","Pretentious with some good moments","We were celebrating an anniversary and chose Acadia based on reviews from critics and this site. Sadly, all the laudatory comments on these sites are a mystery as this was an average restaurant trying to pretend it's in the four star category but falling far short. The good: service was stiff but attentive and as someone mentioned on this site, a parade of wait staff to present and clear dishes is unnecessary. We began with an interesting oyster amuse whose sweetness was the overwhelming flavor. We ordered 2 appetizers: risotto and a charcuterie plate.The risotto was delicious, silky and redolent of lemon zest. The charcuterie plate was descent with a silky slice of chicken liver pate and a piece of pate de campagne accompanied by 3 razor thin slices of cornichon and a drop of mostardo and a balsamic sauce which were good but there was too little of it. The not so good:The entrée I ordered was truffled rabbit which was actually a tiny slice of roulade wrapped in bacon the size of a quarter for $32, which sat alone on a plate next to one ramp. The size was laughable and everything on the plate was so over salted that it had to be sent back. If this course was part of a tasting menu, the size wouldn't be quite as much of an issue but as an entrée it was laughable. My spouse's halibut was larger but tasteless with no accompaniments whatsoever sitting forlornly on the plate. Between courses, we were offered 2 very good buttermilk biscuits the size of a quarter which were warm and delicious and later, we were given 2 miniature lobster rolls which were precious things with good lobster inside stale rolls. Serving 3 amuses during a dinner adds to the fact that there needed to be fillers in order to create the impression that one has had a meal here.While the service was generous--they brought us a pour of prosecco to celebrate our anniversary, this restaurant doesn't deliver a true four star or even 3 star experience, and the mostly average food, no matter how artistically presented on a slab of what looked like astroturf can't make up for its shortcomings and its outsized prices. A miniardise at the end was the highlight of the dinner--a chocolate ganache cookie sandwich which was truly a standout. The wine we chose by the glass was a Willamette Valley 2011 Pinot Noir which was outstanding.Having eaten in some great restaurants with great chefs in several countries, I'd have to agree with other comments that this is not the place for sophisticated diners. There are many better choices in Chicago."
"chicago","Acadia","RonnyRDeinze","A5411149F685A3960222D94B46AA0095","en","Mountain View, California","5","June 20, 2014","Rising star","We were happily surprised by the chef and the sommelier: a perfect combination of food and wine. Special mention for the skillfull handling of one of the guests' allergy. "
"chicago","Acadia","380brendanh","95B3528CD3F2DB8BC84DFA7FA8DBA5C9","en","Melbourne, Australia","2","June 19, 2014","Underwhelming","I travelled from Melbourne to come to this restaurant because of the great reviews I'd had read and I wanted the burgerWe sat down and were warmly greated, ordered a beer, this took a while as two of the items on the menu were out. It took 20 mins for our drinks and water to come.We were always going to order the burger so that was easy, but we thought we would order the Korean Chicken which sounded lovely, it was also out tonight making 3 menu items not availableThe 3 gents beside Burgers arrived, just a burger on a plate, no fries, no garnish - looked very ordinaryOurs arrived as well. The overwhelming tast was of the oil or fat it had been cooked inOverall a very disappointing experience, the place had a good vibe, but this can't make up for ordinary service and food. There are many better options"
"chicago","Acadia","skiguy33","99B79A32F179F2D8DDBD9D4673D26EFB","en","Bedford","5","June 17, 2014","Incredible food and craft cocktails","I went here because of the great burger review and man this was one of the best burgers I have ever eaten. They have a nice dining room area but decided to chill and eat at the bar and very glad I did. I learned the bartender is an AMAZING mixologist. Watching him with each cocktail creation was inspiring. The regular menu looked incredible so planning to return next time in Chicago for an expanded culinary and cocktail experience."
"chicago","Acadia","StefanoG524","222F3F5A73BAC86D5F8B7DB2E6DEA25F","en","Flossmoor, Illinois","5","May 6, 2014","One of Chicago's best","If money is not a problem (this place isn't cheap!!), then go for it. This restaurant has it all: nice ambiance, with minimalist décor, impeccable yet warm and friendly - never intimidating as in other pretentious spots - service, exquisite presentations of dishes, outstanding (and reasonably priced!) wine list, but especially incredible quality food. We had a la carte choices, including their signature potato ""risotto"", foie gras, the halibut, the lobster pie, and the beef (this one is by far the best meat dish I have ever had!). All of these were stellar. And the desserts were wonderful too; I'd recommend the delicate Miel. Some reviewers complained about the small portions. Indeed, the servings aren't generous (perhaps, as a timid suggestion, if they were just a tad larger, it would be absolute heaven), but then again you are here for the quality, not the quantity. And the 4 of us left full and happy even after the high price tag. Very, very worthy for special occasions."
"chicago","Acadia","mooresy2","FAFAA7EF4F211AD546F7614F01FB9C6D","en","Champaign-Urbana, Illinois","5","February 26, 2014","Worthy of Michelin and high praise","For such a fine dining establishment there was no pretention and no stuffiness here at all....The service while at times seemed synchronized was very subtle and attentive without being overbearing and intrusive, the decor of the entire restaurant was minimal but extravagent. Thereby the focus was plainly on the food which is where it should be. Since my dining partner is a bit less adventurous than i , we ordered ala carte..I started with the charcuterie and he had the scallop appetizer..Both presented beautifully on the place and both excellent...Next i had the fois gras with the pineapple which completely elevated the fois to another level...savory and sweet...brilliant. He had the heirloom carrot dish which he thoroughly enjoyed it. For our entrees he had the lobster and i had the Sturgeon which was perfectly cooked and blended well with the other items and various drops of sauce on the plate...He felt the lobster texturally was a bit tough but reallly loved the thai style broth it sat on as well as the other elements on the plate..For dessert to be honest i can't tell you what i had or ate...it was just too deconstructed and texturally was just a bunch of small crunchy items in my mouth..My partner had the profiteroles and while they were not a traditional profiterole he enjoyed the dish a lot. While i admit this place is a little off the radar and might feel a little far South for some it is well worth venturing there because you will not be disappointed in the food or the experience overall."
